{
  "entries": [
    {
      "adoptionTier": "reference",
      "canonicalUrl": "https://github.com/abhivaikar/howtheytest",
      "capabilities": [],
      "categories": [
        "Useful References"
      ],
      "credentialRequirement": "none",
      "description": "A curated collection of public resources from tech companies on how they test their software and build a quality culture",
      "executionPolicy": "sandbox_required",
      "id": "abhivaikar--howtheytest",
      "lastValidation": {
        "at": "2026-08-30T18:30:25.161Z",
        "httpStatus": 200,
        "method": "github_api"
      },
      "license": {
        "kind": "permissive",
        "spdx": "CC0-1.0"
      },
      "name": "How They Test",
      "provenance": [
        {
          "catalogCommit": "ff695aac1126d548eb3bc0ceb3d8a0d4e0b9cf93",
          "depth": 1,
          "discoveredAt": "2026-08-28T21:20:23Z",
          "sourceCatalogId": "awesome-testing",
          "urlAsLinked": "https://github.com/abhivaikar/howtheytest"
        }
      ],
      "redirectHistory": [],
      "repository": {
        "commitSha": "743e44913377af238bfdafeab4a1a1ba3b66aab5",
        "defaultBranch": "master",
        "name": "howtheytest",
        "owner": "abhivaikar",
        "reportedSizeKb": 1212,
        "submodulePath": "sources/direct/abhivaikar/abhivaikar--howtheytest"
      },
      "resolutionStatus": "active",
      "targetKind": "awesome_list"
    },
    {
      "adoptionTier": "reference",
      "canonicalUrl": "https://github.com/ai-dashboad/flutter-skill",
      "capabilities": [
        "ai",
        "e2e",
        "mobile"
      ],
      "categories": [
        "UI & End-to-End Testing"
      ],
      "credentialRequirement": "none",
      "description": "AI-powered E2E testing via MCP for Flutter, React Native, iOS, Android, Electron, Tauri, KMP, and .NET MAUI. Zero test code.",
      "executionPolicy": "reference_only",
      "id": "ai-dashboad--flutter-skill",
      "lastValidation": {
        "at": "2026-08-30T18:30:25.161Z",
        "httpStatus": 200,
        "method": "github_api"
      },
      "license": {
        "spdx": null,
        "kind": "missing"
      },
      "name": "flutter-skill",
      "provenance": [
        {
          "catalogCommit": "ff695aac1126d548eb3bc0ceb3d8a0d4e0b9cf93",
          "depth": 1,
          "discoveredAt": "2026-08-28T21:20:23Z",
          "sourceCatalogId": "awesome-testing",
          "urlAsLinked": "https://github.com/ai-dashboad/flutter-skill"
        }
      ],
      "redirectHistory": [],
      "repository": {
        "commitSha": "de1a0081c2981d37e088b07d081e0471d040ddee",
        "defaultBranch": "main",
        "name": "flutter-skill",
        "owner": "ai-dashboad",
        "reportedSizeKb": 68402,
        "submodulePath": "sources/direct/ai-dashboad/ai-dashboad--flutter-skill"
      },
      "resolutionStatus": "active",
      "targetKind": "git_repo"
    },
    {
      "adoptionTier": "reference",
      "canonicalUrl": "https://github.com/aiqualitylab/ai-natural-language-tests",
      "capabilities": [
        "ai",
        "e2e",
        "framework",
        "browser-automation"
      ],
      "categories": [
        "Test Automation Frameworks"
      ],
      "credentialRequirement": "none",
      "description": "Generates Cypress and Playwright E2E tests from natural language requirements using LangGraph, ChromaDB, and multi-provider LLM support.",
      "executionPolicy": "sandbox_required",
      "id": "aiqualitylab--ai-natural-language-tests",
      "lastValidation": {
        "at": "2026-08-30T18:30:25.161Z",
        "httpStatus": 200,
        "method": "github_api"
      },
      "license": {
        "kind": "copyleft",
        "spdx": "AGPL-3.0"
      },
      "name": "ai-natural-language-tests",
      "provenance": [
        {
          "catalogCommit": "ff695aac1126d548eb3bc0ceb3d8a0d4e0b9cf93",
          "depth": 1,
          "discoveredAt": "2026-08-28T21:20:23Z",
          "sourceCatalogId": "awesome-testing",
          "urlAsLinked": "https://github.com/aiqualitylab/ai-natural-language-tests"
        }
      ],
      "redirectHistory": [],
      "resolutionStatus": "dead",
      "targetKind": "other"
    },
    {
      "adoptionTier": "reference",
      "canonicalUrl": "https://github.com/aliesbelik/awesome-jmeter",
      "capabilities": [],
      "categories": [
        "Useful References"
      ],
      "credentialRequirement": "none",
      "description": "A curated collection of resources around Apache JMeter.",
      "executionPolicy": "reference_only",
      "id": "aliesbelik--awesome-jmeter",
      "lastValidation": {
        "at": "2026-08-30T18:30:25.161Z",
        "httpStatus": 200,
        "method": "github_api"
      },
      "license": {
        "kind": "unknown",
        "spdx": "CC-BY-4.0"
      },
      "name": "Awesome JMeter",
      "provenance": [
        {
          "catalogCommit": "ff695aac1126d548eb3bc0ceb3d8a0d4e0b9cf93",
          "depth": 1,
          "discoveredAt": "2026-08-28T21:20:23Z",
          "sourceCatalogId": "awesome-testing",
          "urlAsLinked": "https://github.com/aliesbelik/awesome-jmeter"
        }
      ],
      "redirectHistory": [],
      "repository": {
        "commitSha": "ea110f64a3b78443dd61734ab1b5f1b1a371378a",
        "defaultBranch": "main",
        "name": "awesome-jmeter",
        "owner": "aliesbelik",
        "reportedSizeKb": 310,
        "submodulePath": "sources/direct/aliesbelik/aliesbelik--awesome-jmeter"
      },
      "resolutionStatus": "active",
      "targetKind": "awesome_list"
    },
    {
      "adoptionTier": "reference",
      "canonicalUrl": "https://github.com/altansayan/mock-jutsu-api",
      "capabilities": [
        "api",
        "mocking",
        "test-data"
      ],
      "categories": [
        "Test Data Management"
      ],
      "credentialRequirement": "none",
      "description": "Algorithmic open-source mock data engine generating 390+ format-valid types (IBAN, TCKN, Luhn, VIN, NHS, SWIFT, MRZ and more). CLI + REST API + Python package + JMeter",
      "executionPolicy": "reference_only",
      "id": "altansayan--mock-jutsu-api",
      "lastValidation": {
        "at": "2026-08-30T18:30:25.161Z",
        "httpStatus": 200,
        "method": "github_api"
      },
      "license": {
        "kind": "unknown",
        "spdx": "NOASSERTION"
      },
      "name": "MockJutsu",
      "provenance": [
        {
          "catalogCommit": "ff695aac1126d548eb3bc0ceb3d8a0d4e0b9cf93",
          "depth": 1,
          "discoveredAt": "2026-08-28T21:20:23Z",
          "sourceCatalogId": "awesome-testing",
          "urlAsLinked": "https://github.com/altansayan/mock-jutsu-api"
        }
      ],
      "redirectHistory": [],
      "repository": {
        "commitSha": "55c1e77e2371fd7d4db79164d6aabbe7a6fd3862",
        "defaultBranch": "main",
        "name": "mock-jutsu-api",
        "owner": "altansayan",
        "reportedSizeKb": 80358,
        "submodulePath": "sources/direct/altansayan/altansayan--mock-jutsu-api"
      },
      "resolutionStatus": "active",
      "targetKind": "git_repo"
    },
    {
      "adoptionTier": "reference",
      "canonicalUrl": "https://sendgrid.com/blog/1000-foot-overview-of-writing-cypress-tests-frontendtwiliosendgrid",
      "capabilities": [],
      "categories": [
        "Companies & how they test their software"
      ],
      "credentialRequirement": "none",
      "description": "",
      "executionPolicy": "reference_only",
      "id": "1-000-foot-overview-of-writing-cypress-tests-sendgrid-com",
      "lastValidation": {
        "at": "2026-08-30T18:30:25.161Z",
        "method": "manual",
        "notes": "discovered via nested catalog; provider check pending"
      },
      "license": {
        "kind": "unknown",
        "spdx": null
      },
      "name": "1,000 Foot Overview of Writing Cypress Tests",
      "provenance": [
        {
          "catalogCommit": "743e44913377af238bfdafeab4a1a1ba3b66aab5",
          "depth": 2,
          "discoveredAt": "2026-08-30T18:30:25.161Z",
          "sourceCatalogId": "abhivaikar--howtheytest",
          "urlAsLinked": "https://sendgrid.com/blog/1000-foot-overview-of-writing-cypress-tests-frontendtwiliosendgrid/"
        }
      ],
      "redirectHistory": [],
      "resolutionStatus": "unresolved",
      "targetKind": "website"
    },
    {
      "adoptionTier": "reference",
      "canonicalUrl": "https://www.bbc.co.uk/blogs/internet/entries/e9356c0f-cf17-4ccc-bb05-2fa5d13fa289",
      "capabilities": [],
      "categories": [
        "Companies & how they test their software"
      ],
      "credentialRequirement": "none",
      "description": "",
      "executionPolicy": "reference_only",
      "id": "10-guidelines-on-readability-and-consistency-when-writing-integration-tests-www-bbc-co-uk",
      "lastValidation": {
        "at": "2026-08-30T18:30:25.161Z",
        "method": "manual",
        "notes": "discovered via nested catalog; provider check pending"
      },
      "license": {
        "kind": "unknown",
        "spdx": null
      },
      "name": "10 guidelines on readability and consistency when writing Integration Tests",
      "provenance": [
        {
          "catalogCommit": "743e44913377af238bfdafeab4a1a1ba3b66aab5",
          "depth": 2,
          "discoveredAt": "2026-08-30T18:30:25.161Z",
          "sourceCatalogId": "abhivaikar--howtheytest",
          "urlAsLinked": "https://www.bbc.co.uk/blogs/internet/entries/e9356c0f-cf17-4ccc-bb05-2fa5d13fa289"
        }
      ],
      "redirectHistory": [],
      "resolutionStatus": "unresolved",
      "targetKind": "website"
    },
    {
      "adoptionTier": "reference",
      "canonicalUrl": "https://ebaytech.berlin/100-percent-test-coverage-is-not-enough-3d733551bc3f",
      "capabilities": [],
      "categories": [
        "Companies & how they test their software"
      ],
      "credentialRequirement": "none",
      "description": "",